{
  "profile": {
    "id": "team-default",
    "version": "1.0.0",
    "digest": "sha256:team-default-v1"
  },
  "nodeKinds": [
    "frame",
    "text",
    "image",
    "icon",
    "component-instance"
  ],
  "tokens": [
    "color.primary",
    "radius.md",
    "space.4",
    "surface.canvas"
  ],
  "components": {
    "ui.button": {
      "id": "ui.button",
      "allowedVariants": {
        "type": [
          "default",
          "primary"
        ]
      },
      "slots": {
        "children": {
          "type": "string"
        }
      },
      "overrides": {
        "children": {
          "type": "string"
        }
      }
    },
    "ui.float-button": {
      "id": "ui.float-button"
    },
    "ui.icon": {
      "id": "ui.icon"
    },
    "ui.typography": {
      "id": "ui.typography"
    },
    "ui.divider": {
      "id": "ui.divider"
    },
    "ui.flex": {
      "id": "ui.flex"
    },
    "ui.grid": {
      "id": "ui.grid"
    },
    "ui.layout": {
      "id": "ui.layout"
    },
    "ui.masonry": {
      "id": "ui.masonry"
    },
    "ui.space": {
      "id": "ui.space"
    },
    "ui.splitter": {
      "id": "ui.splitter"
    },
    "ui.anchor": {
      "id": "ui.anchor"
    },
    "ui.breadcrumb": {
      "id": "ui.breadcrumb"
    },
    "ui.dropdown": {
      "id": "ui.dropdown"
    },
    "ui.menu": {
      "id": "ui.menu",
      "overrides": {
        "items": {
          "type": "array"
        }
      }
    },
    "ui.pagination": {
      "id": "ui.pagination"
    },
    "ui.steps": {
      "id": "ui.steps"
    },
    "ui.tabs": {
      "id": "ui.tabs"
    },
    "ui.auto-complete": {
      "id": "ui.auto-complete"
    },
    "ui.cascader": {
      "id": "ui.cascader"
    },
    "ui.checkbox": {
      "id": "ui.checkbox"
    },
    "ui.color-picker": {
      "id": "ui.color-picker"
    },
    "ui.date-picker": {
      "id": "ui.date-picker"
    },
    "ui.form": {
      "id": "ui.form",
      "slots": {
        "children": {
          "type": "nodes"
        }
      }
    },
    "ui.input": {
      "id": "ui.input",
      "overrides": {
        "placeholder": {
          "type": "string"
        }
      }
    },
    "ui.input-number": {
      "id": "ui.input-number"
    },
    "ui.mentions": {
      "id": "ui.mentions"
    },
    "ui.radio": {
      "id": "ui.radio"
    },
    "ui.rate": {
      "id": "ui.rate"
    },
    "ui.select": {
      "id": "ui.select"
    },
    "ui.slider": {
      "id": "ui.slider"
    },
    "ui.switch": {
      "id": "ui.switch"
    },
    "ui.time-picker": {
      "id": "ui.time-picker"
    },
    "ui.transfer": {
      "id": "ui.transfer"
    },
    "ui.tree-select": {
      "id": "ui.tree-select"
    },
    "ui.upload": {
      "id": "ui.upload"
    },
    "ui.avatar": {
      "id": "ui.avatar"
    },
    "ui.badge": {
      "id": "ui.badge"
    },
    "ui.calendar": {
      "id": "ui.calendar"
    },
    "ui.card": {
      "id": "ui.card",
      "slots": {
        "children": {
          "type": "nodes"
        }
      }
    },
    "ui.carousel": {
      "id": "ui.carousel"
    },
    "ui.collapse": {
      "id": "ui.collapse"
    },
    "ui.descriptions": {
      "id": "ui.descriptions"
    },
    "ui.empty": {
      "id": "ui.empty"
    },
    "ui.image": {
      "id": "ui.image"
    },
    "ui.list": {
      "id": "ui.list"
    },
    "ui.popover": {
      "id": "ui.popover"
    },
    "ui.qr-code": {
      "id": "ui.qr-code"
    },
    "ui.segmented": {
      "id": "ui.segmented"
    },
    "ui.statistic": {
      "id": "ui.statistic"
    },
    "ui.table": {
      "id": "ui.table"
    },
    "ui.tag": {
      "id": "ui.tag"
    },
    "ui.timeline": {
      "id": "ui.timeline"
    },
    "ui.tooltip": {
      "id": "ui.tooltip"
    },
    "ui.tour": {
      "id": "ui.tour"
    },
    "ui.tree": {
      "id": "ui.tree"
    },
    "ui.alert": {
      "id": "ui.alert"
    },
    "ui.drawer": {
      "id": "ui.drawer"
    },
    "ui.message": {
      "id": "ui.message"
    },
    "ui.modal": {
      "id": "ui.modal"
    },
    "ui.notification": {
      "id": "ui.notification"
    },
    "ui.popconfirm": {
      "id": "ui.popconfirm"
    },
    "ui.progress": {
      "id": "ui.progress"
    },
    "ui.result": {
      "id": "ui.result"
    },
    "ui.skeleton": {
      "id": "ui.skeleton"
    },
    "ui.spin": {
      "id": "ui.spin"
    },
    "ui.watermark": {
      "id": "ui.watermark"
    },
    "ui.affix": {
      "id": "ui.affix"
    },
    "ui.app": {
      "id": "ui.app"
    },
    "ui.border-beam": {
      "id": "ui.border-beam"
    },
    "ui.config-provider": {
      "id": "ui.config-provider"
    },
    "ui.util": {
      "id": "ui.util"
    }
  },
  "layout": {
    "modes": [
      "flex",
      "absolute"
    ],
    "sizing": [
      "fixed",
      "fill",
      "hug",
      "minmax"
    ]
  },
  "icons": [
    "check",
    "close"
  ]
}
